perso 3,cinq milliards d'euro par an
perso 3,explique Bruno Cavalier à la tête de la fédération nationale des travaux publics
perso 3,on met beaucoup de temps
perso 3,les journées risquent d'être plus longues
perso 3,vous savez dans des entreprises de BTP
perso 3,où les marges sont de deux pour cent
perso 3,quand vous imaginez aujourd'hui qu' on peut avoir des surcoûts de 10  15  même 20 pour cent
perso 3,les entreprises n'y survivraient pas
perso 3,donc il faut tous ensemble que nous trouvions la solution
perso 3,un dossier sensible de plus sur la table du gouvernement
perso 3,reportage signé claire chaudière à retrouver sur notre site à la page du grand angle notre invité dans cinq minutes et raymond girardi vice président du syndicat agricole modef le monde agricole manquent de main d' oeuvre les exploitants espèrent pouvoir bientôt retrouver les saisonniers étrangers
perso 3,et s' il est trop tôt pour chiffrer le retard éventuelle pris pour la livraison des futurs lignes de métro
perso 3,mais pour le moment tout est bloqué à cause de l' épidémie
perso 3,une menuiserie qui se lancent dans la découpe de plexiglas pour faire face à la crise voilà un exemple de con de reconversion rapide et réussi l' entreprise a tellement de commandes qu' à embaucher de nouveaux salariés son patron est l' invité de philippe bertrand dans deux minutes d' abord voici la suite
perso 3,de notre feuilleton sportif dans les eaux de france où de nombreux clubs amateurs de sport collectif
perso 3,sont exsangues s' empare spectacle de reprise avec des budgets à boucler pour la prochaine saison et pour certains la crainte de perdre des licenciés
perso 3,la ministre des sports roxana maracineanu nous a promis cette semaine un plan de relance mais sans livrer de détails et sur le terrain le chevet striée l' inquiétude grandit jour après jour
perso 3,la question des surcoûts liés à la crise en revanche
perso 3,l' image peut sembler anecdotique et pourtant les pâquerettes envahissent toujours du les terrains de foot des petits clubs amateurs comme celui du sporting club dany
perso 3,on a l' impression que on est dans un film de science fiction où tout le monde est parti et on n' est plus revenue patres
perso 3,bazin ce qui a le président de ce club du département du nord fort de trois cent quarante sept licencier avec lesquels il tente d' entretenir les liens via les réseaux sociaux mais sans trop savoir de quoi l' avenir sera fait
perso 3,comment refaire venir les les gamins au stade euh actuellement euh financièrement avec nos partenaires eux aussi ont subi les conséquences parallèlement sa du premier mais on va dire jusqu' au trente juin c' est là où on organise nos plus grandes manifestations sportives
perso 3,avec les tournois les l' auto les brocante qui font rentrer de l' argent dans les caisses des clubs là rien mais
perso 3,est déjà sur toutes les lèvres
perso 3,elle concerne de nombreux chantiers
